{
  "mode": "symbol-evidence-locate",
  "query": "approve order",
  "hits": [
    {
      "file": "src/order-service.js",
      "line": 42,
      "snippet": "function approveOrder(orderId, actorId) {",
      "symbol": "approveOrder",
      "score": 0.92,
      "source": "symbol-heuristic"
    },
    {
      "file": "src/order-controller.js",
      "line": 18,
      "snippet": "const result = orderService.approveOrder(orderId, user.id);",
      "symbol": "approveOrder",
      "score": 0.81,
      "source": "text-grep"
    }
  ],
  "evidence": {
    "confidence": "high",
    "reliable": true,
    "fallback_action": "allow_write",
    "advisory": "Symbol evidence is strong enough for scoped code change."
  },
  "summary": {
    "searched_files": 38,
    "candidate_files": 12,
    "total_hits": 6,
    "reliable_hits": 3
  }
}
